{
  "openbrick": "1.0",
  "id": "ndn.logo-tile",
  "version": "1.2.0",
  "name": "Logo tile",
  "license": "CC0-1.0",
  "credit": { "author": "Neural Deep Network", "url": "https://neuraldeep.net" },
  "provenance": { "source": "original", "modified": false, "history": [] },
  "params": {
    "size":   { "type": "grid2", "unit": "stud", "default": [2, 4], "min": [1, 1], "max": [16, 32], "group": "Size", "manipulator": "corner" },
    "height": { "type": "enum", "default": "plate", "options": [ { "value": "plate", "label": "Plate (1/3)" }, { "value": "brick", "label": "Brick" } ], "group": "Size" },
    "logo":   { "type": "svg", "default": "assets/mark.svg", "group": "Artwork", "help": "Single-colour SVG; lines under 0.8 mm are removed" },
    "relief": { "type": "enum", "default": "emboss", "options": ["emboss", "deboss", "inlay"], "group": "Artwork" },
    "reliefHeight": { "type": "length", "unit": "mm", "default": 0.6, "min": 0.2, "max": 1.5, "step": 0.1, "visibleWhen": "relief != 'inlay'", "help": "Deboss is clamped so 1.8 mm of cavity remains (0.4 mm on plates)" },
    "margin": { "type": "length", "unit": "mm", "default": 1.0, "min": 0.4, "max": 4 }
  },
  "features": [
    { "id": "body",   "op": "body.tile",  "size": "$size", "height": "$height", "round": { "tier": "chamfer", "radius": "0.3mm" } },
    { "id": "bottom", "op": "tube.field", "on": "body.bottom", "grid": "auto", "fitCritical": true },
    { "id": "art",    "op": "relief.svg", "on": "body.top", "src": "$logo", "mode": "$relief", "height": "$reliefHeight",
      "fit": { "margin": "$margin", "align": "center", "keepAspect": true }, "minFeature": "profile.minFeature", "colorRole": "accent" }
  ],
  "snap": "derived",
  "print": { "up": { "emboss": "top", "deboss": "top", "inlay": "bottom" }, "profiles": ["fdm-0.4", "fdm-0.2", "resin-msla"], "fitCritical": ["bottom"] },
  "export": { "formats": ["3mf", "stl", "ldr"], "batch": { "filename": "{id}-{size[0]}x{size[1]}-{serial:04}", "serial": { "mode": "deboss", "on": "body.bottom", "height": "0.4mm" } } }
}
